<?xml version="1.0" encoding="utf-8"?>
<xs:schema xmlns:xsi="http://www.w3.org/2001/XMLSchema-instance" attributeFormDefault="unqualified" elementFormDefault="qualified" xmlns:xs="http://www.w3.org/2001/XMLSchema">
  <xs:element name="themes">
    <xs:complexType>
      <xs:sequence>
        <xs:element maxOccurs="unbounded" name="theme">
          <xs:complexType>
            <xs:sequence>
              <xs:element maxOccurs="unbounded" name="visualelement">
                <xs:complexType>
                  <xs:attribute name="type" type="xs:string" use="required" />
                  <xs:attribute name="name" type="xs:string" use="required" />
                  <xs:attribute name="value" type="xs:string" use="required" />
                </xs:complexType>
              </xs:element>
            </xs:sequence>
            <xs:attribute name="name" type="xs:string" use="required" />
          </xs:complexType>
        </xs:element>
      </xs:sequence>
    </xs:complexType>
  </xs:element>
</xs:schema>